{
  "$schema": "https://json-schema.org/draft/2020-12/schema",
  "$id": "https://prompt-debugger.dev/schemas/knowledge-misuse-policy/v1",
  "title": "Misuse Policy file v1",
  "description": "Provider-neutral, declarative description of how the legitimacy of rewriting is classified. Descriptive prose and closed enums only; contains no executable logic, expressions, or branching. The analyzer interprets this data; it does not execute it. The 'rationale' fields are maintainer documentation and must not affect runtime behavior.",
  "type": "object",
  "additionalProperties": false,
  "required": ["schema_version", "policy_version", "classes", "procedure", "elicitation", "decline_templates", "status"],
  "properties": {
    "schema_version": { "const": 1 },
    "policy_version": {
      "type": "string",
      "pattern": "^[0-9]{4}\\.(0[1-9]|1[0-2])(-[a-z0-9]+)?$",
      "description": "Content version, YYYY.MM with an optional tag. The month is calendar-validated (01-12)."
    },
    "classes": {
      "type": "array",
      "minItems": 3,
      "maxItems": 3,
      "description": "The closed set of classification outcomes for the legitimacy of rewriting.",
      "items": {
        "type": "object",
        "additionalProperties": false,
        "required": ["id", "class", "definition", "gate_outcome", "analyzer_action", "rationale"],
        "properties": {
          "id": {
            "type": "string",
            "pattern": "^MISUSE-[0-9]{3}$",
            "description": "Stable, permanent registry key. Never reused, renumbered, or repurposed."
          },
          "class": {
            "type": "string",
            "enum": ["legitimate", "ambiguous", "prohibited"],
            "description": "Closed semantic class identity, distinct from the registry id."
          },
          "definition": { "type": "string", "minLength": 1 },
          "gate_outcome": {
            "type": "string",
            "enum": ["passed_or_conditional", "elicit", "declined"],
            "description": "Declarative association from class to the Rewrite Report gate space. The analyzer chooses within 'passed_or_conditional' at runtime; this names only the permitted space."
          },
          "analyzer_action": { "type": "string", "minLength": 1 },
          "rationale": {
            "type": "string",
            "minLength": 1,
            "description": "Maintainer-facing documentation only; must not affect runtime behavior."
          }
        }
      }
    },
    "procedure": {
      "type": "array",
      "minItems": 1,
      "description": "The neutral classification steps, applied in array order. An ordered checklist, not a flowchart; contains no branching directives.",
      "items": {
        "type": "object",
        "additionalProperties": false,
        "required": ["id", "description", "rationale"],
        "properties": {
          "id": {
            "type": "string",
            "pattern": "^MISUSE-[0-9]{3}$",
            "description": "Stable, permanent registry key. Never reused."
          },
          "description": { "type": "string", "minLength": 1 },
          "rationale": {
            "type": "string",
            "minLength": 1,
            "description": "Maintainer-facing documentation only; must not affect runtime behavior."
          }
        }
      }
    },
    "elicitation": {
      "type": "object",
      "additionalProperties": false,
      "description": "The ask-don't-guess rule for the 'ambiguous' class. A singleton, addressed by name; it carries no registry id.",
      "required": ["when", "guidance", "rationale"],
      "properties": {
        "when": { "type": "string", "minLength": 1 },
        "guidance": { "type": "string", "minLength": 1 },
        "rationale": {
          "type": "string",
          "minLength": 1,
          "description": "Maintainer-facing documentation only; must not affect runtime behavior."
        }
      }
    },
    "decline_templates": {
      "type": "array",
      "minItems": 1,
      "description": "Fixed decline wording the gate uses when a rewrite is declined.",
      "items": {
        "type": "object",
        "additionalProperties": false,
        "required": ["id", "text", "rationale"],
        "properties": {
          "id": {
            "type": "string",
            "pattern": "^MISUSE-[0-9]{3}$",
            "description": "Stable, permanent registry key. Never reused."
          },
          "text": { "type": "string", "minLength": 1 },
          "rationale": {
            "type": "string",
            "minLength": 1,
            "description": "Maintainer-facing documentation only; must not affect runtime behavior."
          }
        }
      }
    },
    "status": { "type": "string", "enum": ["draft", "active", "deprecated"] }
  }
}
